{
  "description": "Defines the SPDX allowlist and explicit dependency reviews consumed by repository license checks.",
  "schemaVersion": 2,
  "allowEverywhere": [
    "0BSD",
    "Apache-2.0",
    "BSD-2-Clause",
    "BSD-3-Clause",
    "BSL-1.0",
    "CC0-1.0",
    "ISC",
    "MIT",
    "MIT-0",
    "MPL-2.0",
    "PostgreSQL",
    "PSF-2.0",
    "Python-2.0",
    "Unicode-3.0",
    "Unlicense",
    "Zlib"
  ],
  "allowOsPackages": [
    "Artistic-2.0",
    "Classpath-exception-2.0",
    "GCC-exception-3.1",
    "GFDL-1.1-only",
    "GFDL-1.1-or-later",
    "GFDL-1.2-only",
    "GFDL-1.2-or-later",
    "GFDL-1.3-only",
    "GFDL-1.3-or-later",
    "GPL-1.0-only",
    "GPL-1.0-or-later",
    "GPL-2.0-only",
    "GPL-2.0-or-later",
    "GPL-3.0-only",
    "GPL-3.0-or-later",
    "LGPL-2.0-only",
    "LGPL-2.0-or-later",
    "LGPL-2.1-only",
    "LGPL-2.1-or-later",
    "LGPL-3.0-only",
    "LGPL-3.0-or-later",
    "LLVM-exception"
  ],
  "allowDevTools": [
    "GPL-2.0-only",
    "GPL-2.0-or-later",
    "GPL-3.0-only",
    "GPL-3.0-or-later",
    "LGPL-2.1-only",
    "LGPL-2.1-or-later",
    "LGPL-3.0-only",
    "LGPL-3.0-or-later",
    "MPL-2.0"
  ],
  "reviewedPackageLicenses": [
    {
      "ecosystem": "npm",
      "exception": "The locked npm release declares the permissive BlueOak-1.0.0 license accepted by the shipped dependency gate.",
      "license": "BlueOak-1.0.0",
      "package": "sax",
      "scanner": "osv",
      "sourceRegex": "/pnpm-lock\\.yaml$",
      "version": "1.6.1"
    }
  ],
  "reviewedDependencies": {
    "bazelModules": [
      {
        "license": "Apache-2.0",
        "name": "aspect_bazel_lib",
        "version": "2.22.5"
      },
      {
        "license": "Apache-2.0",
        "name": "aspect_rules_js",
        "version": "3.4.1"
      },
      {
        "license": "Apache-2.0",
        "name": "gazelle",
        "version": "0.53.0"
      },
      {
        "license": "Apache-2.0",
        "name": "platforms",
        "version": "1.0.0"
      },
      {
        "license": "Apache-2.0",
        "name": "rules_go",
        "version": "0.59.0"
      },
      {
        "license": "Apache-2.0",
        "name": "rules_helm",
        "version": "0.31.0"
      },
      {
        "license": "Apache-2.0",
        "name": "rules_kustomize",
        "version": "0.5.3"
      },
      {
        "license": "Apache-2.0",
        "name": "rules_multitool",
        "version": "1.11.1"
      },
      {
        "license": "Apache-2.0",
        "name": "rules_oci",
        "version": "2.3.0"
      },
      {
        "license": "Apache-2.0",
        "name": "rules_pkg",
        "version": "1.3.0"
      },
      {
        "license": "Apache-2.0",
        "name": "rules_python",
        "version": "2.3.2"
      },
      {
        "license": "Apache-2.0",
        "name": "rules_python_gazelle_plugin",
        "version": "2.3.2"
      },
      {
        "license": "Apache-2.0",
        "name": "rules_shell",
        "version": "0.8.0"
      },
      {
        "license": "Apache-2.0",
        "name": "rules_tf",
        "version": "0.0.10"
      }
    ],
    "terraformProviders": [
      {
        "license": "MPL-2.0",
        "source": "registry.opentofu.org/coder/coder",
        "version": "2.19.0"
      },
      {
        "license": "MPL-2.0",
        "source": "registry.opentofu.org/cloudflare/cloudflare",
        "version": "5.24.0"
      },
      {
        "license": "MPL-2.0",
        "source": "registry.opentofu.org/hashicorp/archive",
        "version": "2.8.0"
      },
      {
        "license": "MPL-2.0",
        "source": "registry.opentofu.org/hashicorp/aws",
        "version": "6.61.0"
      },
      {
        "license": "MPL-2.0",
        "source": "registry.opentofu.org/hashicorp/aws",
        "version": "6.62.0"
      },
      {
        "license": "MPL-2.0",
        "source": "registry.opentofu.org/hashicorp/google",
        "version": "7.45.0"
      },
      {
        "license": "MPL-2.0",
        "source": "registry.opentofu.org/hashicorp/google",
        "version": "7.46.0"
      },
      {
        "license": "MPL-2.0",
        "source": "registry.opentofu.org/hashicorp/google-beta",
        "version": "7.45.0"
      },
      {
        "license": "MPL-2.0",
        "source": "registry.opentofu.org/hashicorp/helm",
        "version": "3.2.0"
      },
      {
        "license": "MPL-2.0",
        "source": "registry.opentofu.org/hashicorp/kubernetes",
        "version": "3.2.1"
      },
      {
        "license": "MPL-2.0",
        "source": "registry.opentofu.org/hashicorp/local",
        "version": "2.9.0"
      },
      {
        "license": "MPL-2.0",
        "source": "registry.opentofu.org/hashicorp/tls",
        "version": "4.3.0"
      },
      {
        "license": "MPL-2.0",
        "source": "registry.opentofu.org/kreuzwerker/docker",
        "version": "4.5.0"
      },
      {
        "license": "MIT",
        "source": "registry.opentofu.org/tailscale/tailscale",
        "version": "0.29.2"
      },
      {
        "license": "Apache-2.0",
        "source": "terraform.invalid/internal/hkdf",
        "version": "0.1.0"
      }
    ],
    "vendorHelmCharts": [
      {
        "chart": "aws-load-balancer-controller",
        "component": "aws_load_balancer_controller",
        "license": "Apache-2.0",
        "repository": "https://aws.github.io/eks-charts",
        "version": "3.5.0"
      },
      {
        "chart": "plugin-barman-cloud",
        "component": "barman_cloud",
        "license": "Apache-2.0",
        "repository": "https://cloudnative-pg.github.io/charts",
        "version": "0.7.1"
      },
      {
        "chart": "cert-manager",
        "component": "cert_manager",
        "license": "Apache-2.0",
        "repository": "https://charts.jetstack.io",
        "version": "v1.21.1"
      },
      {
        "chart": "altinity-clickhouse-operator",
        "component": "clickhouse_operator",
        "license": "Apache-2.0",
        "repository": "https://helm.altinity.com",
        "version": "0.27.3"
      },
      {
        "chart": "cloudnative-pg",
        "component": "cloudnative_pg",
        "license": "Apache-2.0",
        "repository": "https://cloudnative-pg.github.io/charts",
        "version": "0.29.0"
      },
      {
        "chart": "coder",
        "component": "coder",
        "license": "AGPL-3.0-only",
        "repository": "https://helm.coder.com/v2",
        "version": "2.36.5",
        "exception": "coder-agpl-3.0"
      },
      {
        "chart": "cluster",
        "component": "coder_postgres",
        "license": "Apache-2.0",
        "repository": "ghcr.io/cloudnative-pg/charts",
        "version": "0.8.1"
      },
      {
        "chart": "cluster",
        "component": "headscale_postgres",
        "license": "Apache-2.0",
        "repository": "ghcr.io/cloudnative-pg/charts",
        "version": "0.8.1"
      },
      {
        "chart": "dex",
        "component": "dex",
        "license": "Apache-2.0",
        "repository": "https://charts.dexidp.io",
        "version": "0.24.1"
      },
      {
        "chart": "dragonfly",
        "component": "dragonfly",
        "license": "Apache-2.0",
        "repository": "https://dragonflyoss.github.io/helm-charts",
        "version": "1.8.2"
      },
      {
        "chart": "cluster",
        "component": "dragonfly_postgres",
        "license": "Apache-2.0",
        "repository": "ghcr.io/cloudnative-pg/charts",
        "version": "0.8.1"
      },
      {
        "chart": "gateway-helm",
        "component": "envoy_gateway",
        "license": "Apache-2.0",
        "repository": "registry-1.docker.io/envoyproxy",
        "version": "v1.9.0"
      },
      {
        "chart": "external-dns",
        "component": "external_dns",
        "license": "Apache-2.0",
        "repository": "https://kubernetes-sigs.github.io/external-dns/",
        "version": "1.21.1"
      },
      {
        "chart": "external-secrets",
        "component": "external_secrets",
        "license": "Apache-2.0",
        "repository": "https://charts.external-secrets.io",
        "version": "2.9.0"
      },
      {
        "chart": "falco",
        "component": "falco",
        "license": "Apache-2.0",
        "repository": "https://falcosecurity.github.io/charts",
        "version": "9.1.0"
      },
      {
        "chart": "gpu-operator",
        "component": "gpu_operator",
        "license": "Apache-2.0",
        "repository": "https://helm.ngc.nvidia.com/nvidia",
        "version": "v26.7.0"
      },
      {
        "chart": "headlamp",
        "component": "headlamp",
        "license": "Apache-2.0",
        "repository": "https://kubernetes-sigs.github.io/headlamp/",
        "version": "0.45.0"
      },
      {
        "chart": "kargo",
        "component": "kargo",
        "license": "Apache-2.0",
        "repository": "ghcr.io/akuity/kargo-charts",
        "version": "1.11.2"
      },
      {
        "chart": "karpenter",
        "component": "karpenter_aws",
        "license": "Apache-2.0",
        "repository": "public.ecr.aws/karpenter",
        "version": "1.14.0"
      },
      {
        "chart": "karpenter",
        "component": "karpenter_gcp",
        "license": "Apache-2.0",
        "repository": "https://cloudpilot-ai.github.io/karpenter-provider-gcp",
        "version": "0.6.0"
      },
      {
        "chart": "karpenter-crd",
        "component": "karpenter_gcp_crds",
        "license": "Apache-2.0",
        "repository": "https://cloudpilot-ai.github.io/karpenter-provider-gcp",
        "version": "0.6.0"
      },
      {
        "chart": "keda",
        "component": "keda",
        "license": "Apache-2.0",
        "repository": "https://kedacore.github.io/charts",
        "version": "2.20.2"
      },
      {
        "chart": "keda-add-ons-http",
        "component": "keda_http",
        "license": "Apache-2.0",
        "repository": "https://kedacore.github.io/charts",
        "version": "0.15.0"